"codBien","nomBien","detalleDelBien","serieDelBien","origenDelBien","fechaAdquisicion","precio","cantBien","codCategoria","codDependencias","usuarioID","codAlmacenamiento","codEstado","codMantenimiento","observaciones"
"1","Escritorio","De Metal y Madera Con 3 Gavetas","0","-","1990-01-01","0","1","1","1","48","1","2","1",
"2","Silla Rimax","Con Brazos; N/A; Plástico; Verde; Rimax; N/A","0","-","1990-01-01","10000","2","5","1","48","1","2","1",
"3","Vitrina","Porta Llaves Madera y Vidrio","0","-","1990-01-01","0","1","1","1","48","1","4","1",
"4","Congelador","N/A; Grande; N/A; Blanco y Rojo; N/A; N/A","0","Comodato Cremhelado","1990-01-01","0","1","24","2","94","1","2","1",
"5","Exhibidor","Exhibidor de Mecato; Grande; N/A; N/A; N/A; N/A","0","Propiedad De Fritolay","1990-01-01","0","3","24","2","94","1","2","1",
"6","Exhibidor","Exhibidor de Mecato; Mediano; N/A; N/A; N/A; N/A","0","Institucional","1990-01-01","0","2","24","2","94","1","2","1",
"7","Nevera","Enfriador; Grande; Metal; Azul; N/A; N/A","0","Comodato Postobón","1990-01-01","0","1","24","2","94","1","2","1","Propiedad De Postobón."
"8","Nevera","N/A; Grande; Metal; Roja; N/A; N/A","0","Comodato Cocacola","1990-01-01","0","1","24","2","94","1","2","1","Propiedad De Cocacola"
"9","Extensión","Encauchetado 2X10; 50Mt; N/A; Negro; N/A; N/A","0","Institucional","2021-05-24","357142","1","26","3","109","1","1","1",
"10","Hidrolavadora","3Hp 220Psi; N/A; N/A; Azul; 3Wz-1522-3S4; N/A","0","Institucional","2021-05-24","3193280","1","22","3","109","1","1","1",
"11","Maguera","N/A; 100Mt; Caucho y Lona; N/A; N/A; N/A","0","Institucional","2021-05-24","840337","1","22","3","109","1","1","1",
"12","Silla Rimax","Con Brazos; N/A; Plástico; Verde; Rimax; N/A","0","-","1990-01-01","10000","2","1","3","109","1","2","1",
"13","Bafle","Pequeño Marca Hitronic","0","-","1990-01-01","0","1","6","5","87","1","2","1",
"14","Teatro En Casa","Sonido 5.1; N/A; N/A; Blanco; Kalley; N/A","0","Institucional","2021-11-16","490000","1","7","109","9","1","1","1","S1 A317 (Gimnasio)"
"15","Teatro En Casa","Sonido 5.1; N/A; N/A; Blanco; Kalley; N/A","0","Institucional","2021-11-16","490000","1","7","132","54","1","1","1","2025-02-06  S2 A205 (Aula Catalina Cardona)"
"16","Televisor","Smart Tv; 58p; N/A; Negro; Samsung Au7000; N/A","0","Institucional","2021-11-16","2800000","1","7","47","85","2","1","1","S1 A301 (Aula Javier Córdoba)"
"17","Video Beam","N/A; 800*600; N/A; Blanco; Epson Power Lite 93 ; Con Base Techo","0","Institucional","2021-11-16","1500000","1","7","26","54","2","3","1","2025-02-10 S1 A108 (Aula Dubán Duque)"
"18","Video Beam","N/A; 800*600; N/A; Blanco; Epson Power Lite 93 ; Con Base Techo","0","Institucional","2021-11-16","1500000","1","7","15","27","2","1","1",
"19","Bafle","Pequeño Marca Hitronic","0","-","1990-01-01","0","1","6","7","88","1","2","1",
"20","Base","Para Video Beam","0","-","1990-01-01","0","1","1","7","88","1","2","1",
"21","Cabina Activa","De 8 "" Maxiiu","0","-","1990-01-01","0","1","6","7","88","1","2","1",
"22","Cartelera","Tapizada de 2 Mts","0","-","1990-01-01","0","1","1","7","88","1","2","1",
"23","Cuadro","Maria Mediadora","0","-","1990-01-01","0","1","1","7","88","1","2","1",
"24","Escritorio","De Madera de 2 Gavetas","0","-","1990-01-01","0","1","1","7","88","1","2","1",
"25","Silla","Metal y Plastico Negra","0","-","1990-01-01","0","1","1","7","88","1","2","1",
"26","Silla Universitaria","Universitaria Plastica","0","-","1990-01-01","0","35","1","7","88","1","2","1",
"27","Tablero","En Acrilico de 2 Mts","0","-","1990-01-01","0","2","1","7","88","1","2","1",
"28","Video Beam","Marca Epson Blanco","0","-","1990-01-01","0","1","7","7","88","1","2","1",
"29","Vitrina","De Metal y Vidrio Colanta Puertas","0","-","1990-01-01","0","1","1","7","88","1","2","1",
"30","Bafle","Sonido Interno; Pequeño; N/A; Negro; Hi Tronic; N/A","0","-","1990-01-01","0","1","6","42","114","1","2","1",
"31","Cuadro","Maria Mediadora","0","-","1990-01-01","0","1","1","42","114","1","2","1",
"32","Escritorio","En Madera de 2 Cajones","0","-","1990-01-01","0","1","1","42","114","1","2","1",
"33","Pantalla","Para Video Beam; N/A; N/A; Blanco; N/A; N/A","0","Institucional","1990-01-01","0","1","7","131","54","2","4","1","S1 A108 (Aula Luis Abel Torres)"
"34","Silla","Plastica y Metal Verde","0","-","1990-01-01","0","1","1","42","114","1","2","1",
"35","Silla Universitaria","Universitaria Plastica","0","-","1990-01-01","0","38","1","42","114","1","2","1",
"36","Tablero","En Acrilico 2Mts","0","-","1990-01-01","0","2","1","42","114","1","2","1",
"37","Video Beam","N/A; N/A; N/A; Negro; Optoma; Con Base Techo","0","Institucional","2021-11-16","1500000","1","7","42","114","2","2","1",
"38","Vitrina","Donación Colanta; N/A; Metal Y Vidrio; Gris; N/A; Puertas Sin Chapas","0","Donación Colanta","1990-01-01","0","1","1","42","114","1","2","1","Vidrio Quebrado"
"39","Bafle","Pequeño Marca Hitronic","0","-","1990-01-01","0","1","6","9","100","1","2","1",
"40","Base","Para Video Beam","0","-","1990-01-01","0","1","1","9","100","1","2","1",
"41","Cabina Activa","O Bafle de 8"" Maxlw","0","-","1990-01-01","0","1","6","9","100","1","2","1",
"42","Cuadro","Maria Mediadora","0","-","1990-01-01","0","1","1","9","100","1","2","1",
"43","Escritorio","2 Gavetas; N/A; Madera; N/A; N/A; Sin Llave","0","-","1990-01-01","0","1","1","9","100","1","2","1",
"44","Portátil","N/A; N/A; Negro; Lenovo; N/A","0","Institucional","1990-01-01","0","1","5","26","54","1","3","1",
"45","Silla","Plastica y Metal Negra","0","-","1990-01-01","0","1","1","9","100","1","2","1",
"46","Silla Universitaria","Universitaria Plastica","0","-","1990-01-01","0","37","1","9","100","1","2","1",
"47","Video Beam","Marca Epson Ex3240 Blanco","0","-","1990-01-01","0","1","7","9","100","1","2","1",
"48","Vitrina","Donación Colanta; Grande; Metal Y Vidrio; N/A; N/A; Sin Llaves","0","Donación Colanta","1990-01-01","0","1","1","9","100","1","2","1",
"49","Asta","De Bandera; N/A; Metal; N/A; N/A; N/A","NULL","Institucional","1990-01-01","0","6","20","10","110","1","2","1",
"50","Asta","De Escudo; N/A; Metal; N/A; N/A; N/A","NULL","Institucional","1990-01-01","0","6","20","10","110","1","2","1",
"51","Bandera","Virgen, Banda, IEE, Mpo, Dpto, Nal; N/A; N/A; N/A; N/A; N/A","NULL","Institucional","1990-01-01","0","6","20","10","110","1","2","1",
"52","Bastón","N/A; Grande; Metal; Gris; N/A; N/A","NULL","Municipal","1990-01-01","0","7","4","10","110","1","2","1","Pendiente Por Revisar Total. 2023-04-17"
"53","Bombo","Con Cargador; Grande; Fibra De Vidrio; Blanco; Jimbao; N/A","0","Municipal","1990-01-01","0","3","4","10","110","1","2","1",
"54","Bombo","De Correa; Pequeño; Madera; Negro; N/A; N/A","NULL","Municipal","1990-01-01","0","1","4","10","110","1","2","1",
"55","Campana","De Salsa; N/A; N/A; N/A; N/A; N/A","0","Institucional","2022-11-09","170000","1","4","10","110","1","1","1",
"56","Pendón","Tapizada","0","Institucional","1990-01-01","0","1","1","10","110","1","2","1",
"57","Congas","Merenguera; N/A; Fibra De Vidrio; Negro; Remo; Par","0","Institucional","1990-01-01","0","2","4","10","110","1","2","1",
"58","Congas","De Chirimia; Medianas; Madera; Cafe; Remo; Par","NULL","Institucional","1990-01-01","0","1","4","131","54","1","4","3",
"59","Cornetas","Clarines Soprano; N/A; N/A; N/A; Sonar; Muy Viejas; Sin Boquilla","NULL","Municipal","1990-01-01","0","3","4","10","110","1","2","1","2 Sin Boquillas. Pendiente De Revisar Cantidad 2023-04-17"
"60","Escritorio","Sin Cajones; Grande; Metal; Gris; N/A; N/A","NULL","Institucional","1990-01-01","0","1","4","10","110","1","3","1",
"61","Escudo","Virgen; Banda; IEE; Mpio; Dpto; NAl; N/A; N/A; N/A; N/A; De Protocolo Banda","NULL","Municipal","1990-01-01","0","6","20","10","110","1","2","1",
"62","Estante","Metalica de 4 Niveles","0","Institucional","1990-01-01","0","6","1","10","110","1","2","1",
"63","Güiro","N/A; N/A; N/A; N/A; N/A; N/A","NULL","Institucional","1990-01-01","0","1","4","10","110","1","2","1",
"64","Lira","N/A; Grande; Aluminio; Gris; Águila; N/A","0","Municipal","1990-01-01","0","6","4","10","110","1","2","1","1 Pequeña Mala"
"65","Lira","Marco Gris; Grande; Aluminio; Gris; Inglesa; Gils ; N/A","NULL","Municipal","1990-01-01","0","2","4","10","110","1","2","1",
"66","Multitenor","Con Cargador; N/A; N/A; N/A; Jimbao; N/A","NULL","Institucional","1990-01-01","0","1","4","10","110","1","2","1",
"67","Platillo","N/A; 15cm; Metal; Dorado; N/A; N/A","0","Municipal","1990-01-01","0","4","4","10","110","1","2","1",
"68","Redoblante","De Cargador; Grande; Madera; N/A; Jimbao; N/A","0","Municipal","1990-01-01","0","5","4","10","110","1","2","1",
"69","Redoblante","De Correa; Grande; Madera; N/A; Nacional; N/A","NULL","Municipal","2023-06-14","588000","1","4","10","110","1","2","1",
"70","Silla Ergonómica","Ergonomica Con Brazos","0","Institucional","1990-01-01","0","1","1","131","54","1","4","1",
"71","Tablero","En Acrilico 2Mts","0","Institucional","1990-01-01","0","1","4","10","110","1","2","1",
"72","Tambora","N/A; 18; Madera; N/A; N/A; Para Reparar","0","Municipal","1990-01-01","0","4","4","10","110","1","3","1","1 Para Mantenimiento."
"73","Timbal","N/A; N/A; N/A; N/A; N/A; Completo","NULL","Institucional","1990-01-01","0","1","4","10","110","1","2","1",
"74","Trompetas","De Pistones; N/A; N/A; Dorada; Conductor; Con Boquilla","NULL","Institucional","1990-01-01","0","1","4","10","110","1","2","1",
"75","Base","Para Video Beam","0","-","1990-01-01","0","1","1","11","26","1","2","1",
"76","Escritorio","Madera de 2 Gavetas","0","-","1990-01-01","0","1","1","11","26","1","2","1",
"77","Pantalla","Para Video Beam","0","-","1990-01-01","0","1","7","11","26","1","2","1",
"78","Portátil","Intel Core N4020/Bga; Lcd 14p; N/A; Gris; Asus; N/A","0","Institucional","2021-11-16","1800000","1","5","11","26","1","1","1",
"79","Rac","Para Televisor Con Cajones","0","-","1990-01-01","0","1","1","11","26","1","4","1","En uso; Estaba en S1 A217 (Sala Sistemas 01)"
"80","Silla","Plastica y Metal Negra","0","-","1990-01-01","0","1","1","11","26","1","2","1",
"81","Silla Universitaria","Universitaria Plastica","0","-","1990-01-01","0","40","1","11","26","1","2","1",
"82","Tablero","En Acrilico","0","-","1990-01-01","0","2","1","11","26","1","2","1",
"83","Video Beam","Epson","0","-","1990-01-01","0","1","7","11","26","1","2","1",
"84","Vitrina","Metal y Vidrio Colanta Gris","0","-","1990-01-01","0","1","1","11","26","1","3","1",
"85","Cable 2X1","N/A; 4,5Mt; N/A; N/A; N/A; N/A","NULL","Institucional","1990-01-01","15000","1","6","15","27","1","1","1",
"86","Escritorio","Madera de 2 Gavetas","0","-","1990-01-01","0","1","1","15","27","1","2","1",
"87","Portátil","CPE; N/A; N/A; Negro; Compumax; N/A","2679625","Seduca","1990-01-01","0","1","5","15","27","1","3","1"," 2679625 (Asignado por Francisco)"
"88","Silla","Plastica y Metal Negra","0","-","1990-01-01","0","1","1","15","27","1","2","1",
"89","Silla Universitaria","Universitaria Plastica","0","-","1990-01-01","0","37","1","15","27","1","3","1","HabÃ­an 47; 10 Se Pasaron Al Salón De Juegos. 2023-05-02"
"90","Tablero","En Acrilico de 2 Mts","0","-","1990-01-01","0","2","1","15","27","1","2","1",
"91","Teatro En Casa","Sonido 5.1; N/A; N/A; Blanco; Kalley; N/A","0","Institucional","2021-11-16","490000","1","7","15","27","1","1","1",
"92","Video Beam","3300 Lumens; N/A; N/A; N/A; Ecolight; N/A","0","Institucional","1990-01-01","0","1","7","26","54","2","2","1","2023-03-01 S1 A115 (Aula Yuli Piedrahita)"
"93","Vitrina","De Metal y Vidrio Colanta","0","-","1990-01-01","0","1","1","15","27","1","3","1","La Vitrina No Cuenta Con Cerradura."
"94","Bafle","Pequeño Hi Tronic","0","-","1990-01-01","0","1","6","16","16","1","2","1",
"95","Cabina Activa","O Bafle de 8"" Maxlw","0","-","1990-01-01","0","1","6","53","92","1","2","1",
"96","Calculadora","Cientificas Marca Hp","0","-","1990-01-01","0","14","3","75","113","1","2","1",
"97","Escritorio","De Madera de 2 Gavetas","0","-","1990-01-01","0","1","1","16","16","1","2","1",
"98","Silla","Personal Docente; N/A; Plastico Y Metal; Negro; N/A; N/A","0","-","1990-01-01","0","1","1","16","16","1","2","1",
"99","Silla Universitaria","Universitaria Plastica","0","-","1990-01-01","0","38","1","16","16","1","2","1","2 Malas"
"100","Silla Rimax","Con Brazos; N/A; Plástico; Verde; Rimax; N/A","0","-","1990-01-01","10000","1","1","53","92","1","2","1",
"101","Tablero","N/A; 2mt; Acrílico; Blanco; N/A; N/A","0","-","1990-01-01","0","2","1","16","16","1","2","1",
"102","Tableta","Con Forro Rojo; N/A; N/A; Negra; Aprix; N/A","1618ET033538 - 1618ET033739","Seduca","1990-01-01","250000","19","5","52","96","1","2","1","Desde 1618ET033538 - Hasta 1618ET033739"
"103","Video Beam","N/A; N/A; N/A; N/A; Epson; N/A","0","-","1990-01-01","0","1","7","16","16","1","2","1",
"104","Estante","N/A; N/A; Metal Y Vidrio; Gris; N/A; Chapa Mala","0","-","1990-01-01","0","1","1","16","16","1","2","1",
"105","Atril","Para Auditorio; N/A; Madera; N/A; N/A; N/A","0","-","1990-01-01","0","1","1","48","54","1","2","1","Cambio De Dependencia A Aula De Clase De Docente Lina Lopera"
"106","Bafle","Pequeño L&L Sound","0","-","1990-01-01","0","1","6","17","39","1","2","1",
"107","Cuadro","Mapa de Colombia","0","-","1990-01-01","0","1","1","17","39","1","2","1","Propiedad De La Profesora"
"108","Escritorio","En Madera de 2 Cajones","0","-","1990-01-01","0","1","1","17","39","1","2","1",
"109","Minicomponente","Marca Genius Con 5 Bafles","0","-","1990-01-01","0","1","1","17","39","1","2","1",
"110","Silla","Metalica Tapizada Gris","0","-","1990-01-01","0","1","1","17","39","1","2","1",
"111","Silla Universitaria","Universitaria Plastica","0","-","1990-01-01","0","44","1","17","39","1","3","1",
"112","Tablero","En Acrilico 2Mts","0","-","1990-01-01","0","2","1","17","39","1","2","1",
"113","Video Beam","Marca Epson Power Lite W12","0","-","1990-01-01","0","1","7","17","39","1","2","1",
"114","Vitrina","Madera y Vidrio 2 Puertas","0","-","1990-01-01","0","1","1","17","39","1","2","1",
"115","Mesa","Para Tenis de Mesa Rodachin","0","-","1990-01-01","0","1","1","18","18","1","2","1",
"116","Mesa","Para Tenis de Mesa Rodachin","0","-","1990-01-01","0","1","1","18","18","1","2","1",
"117","Mesa","Plastica Cuadrada","0","-","1990-01-01","0","2","1","18","18","1","2","1","Una Buena, Otra Mala"
"118","Silla Rimax","Con Brazos; N/A; Plástico; Azul; Rimax; N/A","0","-","1990-01-01","10000","28","1","18","18","1","2","1",
"119","Silla Rimax","Con Brazos; N/A; Plástico; Blanco; Rimax; N/A","0","-","1990-01-01","10000","2","1","18","18","1","2","1",
"120","Silla Rimax","Con Brazos; N/A; Plástico; Verde; Rimax; N/A","0","-","1990-01-01","10000","2","1","67","105","1","2","1",
"121","Silla Rimax","Sin Brazos; N/A; Plástico; Blanco; Rimax; N/A","0","-","1990-01-01","10000","6","1","18","18","1","2","1",
"122","Vitrina","Metal y Vidrio 2 Puertas Gris","0","-","1990-01-01","0","1","1","18","18","1","3","1",
"123","Bafle","N/A; Pequeño; Metal; Gris; Taotronics; N/A","0","-","1990-01-01","0","1","6","20","33","1","2","1",
"124","Escritorio","De 2 Cajones; N/A; Madera; N/A; N/A; N/A","0","-","1990-01-01","0","1","1","20","33","1","2","1",
"125","Minicomponente","Con 4 Bafles; N/A; N/A; N/A; Genius; N/A","0","-","1990-01-01","0","1","1","131","54","1","4","1","S1 A120 (Aula Arcadio Ocampo) 2023-05-058"
"126","Portátil","CPE; N/A; N/A; Negro; Compumax; N/A","2679632","Seduca","1990-01-01","0","1","5","20","33","1","2","1","2679632 (Asignado por Francisco)"
"127","Silla Universitaria","Universitaria; N/A; Plastico; Verde; N/A; SEDUCA","0","Seduca","1990-01-01","0","41","1","20","33","1","2","1",
"128","Silla","De Docente; N/A; Metal Y Plastico; Negro; N/A; N/A","0","-","1990-01-01","0","1","1","20","33","1","2","1",
"129","Tablero","N/A; 2 Mt; Acrílico; Blanco; N/A; N/A","0","-","1990-01-01","0","1","1","20","33","1","2","1",
"130","Video Beam","Con Base; N/A; N/A; N/A; View Sonic; N/A","0","-","1990-01-01","0","1","7","20","33","1","3","1",
"131","Estante","En Metal y Vidrio Colanta","0","-","1990-01-01","0","1","1","20","33","1","2","1","Con Chapas Malas"
"132","Escalera","De Tijera de 6 Peldaños","0","-","1990-01-01","0","1","20","125","86","1","2","1","2023-10-19 S2 B102 (Cuarto Útil Primaria) Prestado."
"133","Mesa","Metalicas Con 4 Sillas","0","-","1990-01-01","0","11","1","22","54","1","2","1",
"134","Bafle","Para Computador Logitech","0","-","1990-01-01","0","2","6","23","39","1","2","1",
"135","Computador","De Escritorio Marca Argon","0","-","1990-01-01","0","1","5","23","39","1","3","2","Requiere Mantenimiento, Esta Lento"
"136","Consola","Mixer Behringer Xenyx 1204","0","-","1990-01-01","0","1","6","23","39","1","2","1",
"137","Consola","Sonido Ca3000 Pro Audio","0","-","1990-01-01","0","1","6","23","39","1","4","2","Para reparación"
"138","Gabinete","Madera de 2 Puestos","0","-","1990-01-01","0","1","1","23","39","1","2","1",
"139","Micrófono","Alámbrico; N/A; N/A; N/A; Shure; N/A","0","-","1990-01-01","0","1","6","23","39","1","2","1",
"140","Micrófono","Inalámbrico; N/A; N/A; N/A; Pro Dj; N/A","0","-","1990-01-01","0","2","6","23","39","1","2","1","S1 A117 (aula Lina Lopera)"
"141","Modem","Tp Link","0","-","1990-01-01","0","1","1","23","39","1","2","1",
"142","Portátil","N/A; N/A; Negro; Lenovo; N/A","0","Institucional","1990-01-01","0","1","5","23","39","1","3","1",
"143","Silla Ergonómica","Ergonomica Con Brazos Negra","0","-","1990-01-01","0","1","1","23","39","1","4","1","Para reparación"
"144","Silla Ergonómica","Ergonomica Sin Brazos Negra","0","-","1990-01-01","0","1","1","23","39","1","3","1",
"145","Ups","Power Backs","0","-","1990-01-01","0","1","1","23","39","1","2","1",
"146","Ups","Star Tec","0","-","1990-01-01","0","1","1","23","39","1","2","1",
"147","Archivador","De 5 Puestos; N/A; Metálico; Gris; N/A; (20 Puestos)","0","-","1990-01-01","0","1","1","24","54","1","2","1",
"148","Cocina Integral","En Madera Con Cajoneras","0","-","1990-01-01","0","1","1","24","54","1","2","1",
"149","Computador","De Escritorio Intel Pentium View Sonic","0","-","1990-01-01","0","1","5","24","54","1","2","1",
"150","Computador","De Escritorio Intel Pentium View Sonic","0","-","1990-01-01","0","1","5","24","54","1","2","1",
"151","Computador","De Escritorio Maxitec Hp View Sonic","0","-","1990-01-01","0","1","5","24","54","1","2","1",
"152","Escritorio","Para Modulo Oficina 1 Gaveta","0","-","1990-01-01","0","30","1","24","54","1","2","1",
"153","Horno Microondas","Marca Haceb","0","-","1990-01-01","0","1","1","24","54","1","2","1",
"154","Minicomponente","Marca Behringer","0","-","1990-01-01","0","1","1","24","54","1","2","1",
"155","Modulo Oficina","Tapizado Color Verde + Escritorio","0","-","1990-01-01","0","6","1","24","54","1","2","1",
"156","Nevera","Haceb Color Beige","0","-","1990-01-01","0","1","24","24","54","1","2","1",
"157","Silla","Giratoria; Personal; Tapizada; Negra; N/A; Con Rodachines","0","-","1990-01-01","0","5","1","24","54","1","2","1",
"158","Silla","Metal y Acrilico","0","-","1990-01-01","0","1","1","24","54","1","2","1",
"159","Silla","Metal y Madera","0","-","1990-01-01","0","4","1","24","54","1","2","1",
"160","Silla","Metalica Tapizada Color Negra","0","-","1990-01-01","0","5","1","24","54","1","2","1",
"161","Silla","Plasticas Con Brazo","0","-","1990-01-01","0","12","1","24","54","1","2","1",
"162","Silla Rimax","Con Brazos; N/A; Plástico; Blanco; Rimax; N/A","0","-","1990-01-01","10000","3","1","24","54","1","2","1",
"163","Silla Rimax","Con Brazos; N/A; Plástico; Roja; Rimax; N/A","0","-","1990-01-01","10000","1","1","24","54","1","2","1","S1 A318 (laboratorio Química)"
"164","Silla Rimax","Con Brazos; N/A; Plástico; Verde; Rimax; N/A","0","-","1990-01-01","10000","3","1","24","54","1","2","1",
"165","Silla Rimax","Sin Brazos; N/A; Plástico; Blanco; Rimax; N/A","0","-","1990-01-01","10000","6","1","24","54","1","2","1",
"166","Tablero","En Acrilico","0","-","1990-01-01","0","2","1","24","54","1","2","1",
"167","Tablero","Tipo Pizarra","0","-","1990-01-01","0","1","1","24","54","1","2","1",
"168","Adaptador Wifi","N/A; N/A; N/A; N/A; Tp-Link Ac600; N/A","0","Institucional","1990-01-01","75000","1","9","26","54","1","1","1",
"169","Cable 2X1","N/A; 4,5Mt; N/A; N/A; N/A; N/A","0","Institucional","1990-01-01","15000","1","6","26","54","1","1","1",
"170","Cable Hdmi","N/A; 15Mt; N/A; Negro; N/A; N/A","0","Institucional","1990-01-01","50000","6","6","26","54","1","1","1",
"171","Cable Hdmi","N/A; 30Mt; N/A; Negro; N/A; N/A","0","Institucional","1990-01-01","70000","1","6","26","54","1","1","1",
"172","Cargador Baterías","Aa y Aaa; Pequeño; N/A; Blanco; N/A; N/A","0","Institucional","1990-01-01","20000","1","9","26","54","2","1","1",
"173","Charol","N/A; Mediana; Acero Inoxidable; Plateado; N/A; Cuadrada","NULL","Donación Prom 2018","1990-01-01","20000","4","20","26","54","1","2","1",
"174","Computador","De Escritorio; Intel Core I5 Décima Generación; N/A; N/A; Janus; Con Pantalla y Periféricos","0","Institucional","2021-11-16","2400000","1","5","26","54","1","1","1",
"175","Dispensador Botellón","Agua Fría y Caliente; N/A; N/A; Blanco; Kalley; N/A","0","Institucional","1990-01-01","0","1","9","26","54","1","1","1",
"176","Extensión","N/A; 25Mt; N/A; Blanco; N/A; N/A","NULL","Institucional","1990-01-01","0","1","26","26","54","1","2","1",
"177","Mantel","N/A; N/A; Jackar; Blanco; N/A; N/A","NULL","Donación Prom 2018","1990-01-01","20000","9","20","26","54","1","2","1",
"178","Portátil","Intel Core N4020/Bga; Lcd 14p; N/A; Gris; Asus; N/A","0","Institucional","2021-11-16","1800000","1","5","26","54","1","1","1","S/n M5n0cx02f530193"
"179","Portátil","Intel Core N4020/Bga; Lcd 14p; N/A; Negro; N/A; Compumax; Sin Mouse","PA2021003237","Seduca","1990-01-01","980000","1","5","54","111","1","1","1","No enciende S/N PA2021003237"
"180","Portátil","Intel Core N4020/Bga; Lcd 14p; N/A; Negro; Compumax; N/A       ","PA2021011523","Seduca","1990-01-01","980000","1","5","26","54","1","1","1","PA2021011523"
"181","Portátil","CPE; N/A; N/A; Negro; Compumax; N/A","26101193 - 26106472 ","Seduca","1990-01-01","0","18","5","46","100","1","2","1","26101193 - 26106472 (Son Los Que Estaban En Primaria)"
"182","Regulador De Voltaje","8 Puertos; Pequeño; N/A; Negro; Powets; N/A","0","Institucional","1990-01-01","0","1","9","26","54","1","1","1",
"183","Router","Tp Link Inalambrico Tl.Wr94On","0","Institucional","1990-01-01","0","1","6","26","54","2","1","1",
"184","Tableta","Con Forro Rojo; N/A; N/A; Negra; Aprix; N/A","1618ET033293 - 1618ET037425","Seduca","1990-01-01","250000","8","5","26","54","1","2","1","(Son de Primaria)"
"185","Tableta","Con Forro Rojo; N/A; N/A; Negra; Aprix; N/A","1618ET037428 - 1618ET046239","Seduca","1990-01-01","250000","45","5","46","100","1","2","1","Desde 1618et037428 - Hasta 1618et046239 // 2023-08-01 De Las 29 Hay Una En Mal Estado"
"186","Televisor","Smart Tv; 43p; N/A; Negro; Samsung; N/A","0","Institucional","1990-01-01","0","1","7","26","54","1","1","1",
"187","Video Beam","N/A; 800*600 (Svga); N/A; Blanco; Epson Power Lite S31 ; N/A","0","-","1990-01-01","0","1","7","26","54","2","2","1",
"188","Video Beam","N/A; 800*600 (Svga); N/A; Blanco; Epson Power Lite S39; N/A","0","Institucional","2021-11-16","0","1","7","44","38","1","1","1",
"189","Video Beam","N/A; 800*600 (Svga); N/A; Negro; Epson Power Lite S31 ; N/A","0","Donación Coopecrédito","1990-01-01","0","1","7","26","54","2","2","1",
"190","Archivador","De Pared; N/A; Madera; Negro; N/A; N/A","0","-","1990-01-01","0","3","1","27","103","1","2","1",
"191","Biblioteca","Madera de 4 Niveles + Cajonera","0","-","1990-01-01","0","1","1","27","103","1","2","1",
"192","Cable Hdmi","N/A; 5Mt; N/A; Negro; N/A; N/A","0","Institucional","1990-01-01","18000","1","6","27","103","1","1","1",
"193","Celular","Huawei Y5","0","Institucional","1990-01-01","400000","1","6","27","103","1","1","1","Adolfo Ruiz"
"194","Computador","De Escritorio; Intel Core I5 Décima Generación; N/A; N/A; Janus; Con Pantalla y Periféricos","0","Institucional","2021-11-16","2400000","1","5","27","103","1","1","1",
"195","Computador","De Escritorio; N/A; N/A; Blanco; Lenovo; Todo En Uno","0","-","1990-01-01","0","1","5","27","103","1","2","1",
"196","Computador","De Escritorio; N/A; N/A; Negro; Hp; Todo En Uno","0","-","1990-01-01","0","1","5","27","103","1","2","1",
"197","Cosedora","N/A; N/A; N/A; N/A; Eagle 206; N/A","0","Institucional","1990-01-01","8043","4","9","27","103","1","1","1",
"198","Descansa Pies","Color Negro","0","-","1990-01-01","0","2","1","27","103","1","2","1",
"199","Escritorio","En L; Grande; Madera; Negro; N/A; Con Archivador","0","-","1990-01-01","0","2","1","27","103","1","2","1",
"200","Escritorio","Metal y Madera de 1 Cajon","0","-","1990-01-01","0","1","1","27","103","1","2","1",
"201","Gabinete","Para Rack; N/A; Metálico; N/A; 7Ru F51; N/A","0","Institucional","1990-01-01","300000","1","6","27","103","1","1","1",
"202","Guillotina","N/A; Grande; Metálico; N/A; Bensini; N/A","0","Institucional","1990-01-01","100542","2","9","27","103","1","1","1",
"203","Impresora","Multifuncional; Grande; N/A; Blanco; Bizhub 364 E; N/A","0","Institucional","1990-01-01","0","1","9","27","103","1","1","1",
"204","Impresora","Multifuncional; Grande; N/A; Blanco; Toshiba E-Studio 3555C; N/A","0","Institucional","1990-01-01","0","1","9","27","103","1","1","1",
"205","Mesa","Trapezoidal Madera","0","-","1990-01-01","0","1","1","27","103","1","2","1",
"206","Multitoma","Para Rack ; 8 Puertos; N/A; N/A; N/A; N/A","0","Institucional","1990-01-01","57000","1","6","27","103","1","1","1",
"207","Perchero","En Madera","0","-","1990-01-01","0","1","1","27","103","1","2","1",
"208","Perforadora","2 Huecos; Pequeña; Metálico; N/A; Gipao Gp 05; N/A","0","Institucional","1990-01-01","8043","4","9","27","103","1","1","1",
"209","Porta Llaves","Metalico Blanco","0","-","1990-01-01","0","1","1","27","103","1","2","1",
